{
  "titre": "Barème de tarification",
  "description": "Table de valeur (code/label) pour le barème de tarification",
  "documentationUrl": "https://example.com/docs/normes/CL_BAREME_TARIFICATION.json",
  "version_schema": "v0.0.1",
  "langue": "fr",
  "values": [
    {
      "code": "I",
      "label": "Tarification initio"
    },
    {
      "code": "N",
      "label": "Tarification classique"
    }
  ]
}
